{
  "agent": "ChronoLedger Orchestrator",
  "target_sha": "4fe33830529fd8265056abcd68bb3ce4bee9ffa0",
  "role": "dynamic-test",
  "status": "passed",
  "iteration": 1,
  "tests": [
    {
      "name": "Phase 2.4 static test scenarios check",
      "status": "passed",
      "command": "git diff",
      "exit_code": 0
    }
  ],
  "schema_version": 1,
  "finished_at": "2026-10-08T21:40:15+09:00",
  "base_sha": "4397e8831d9f86cdfa539dd806b76fe69cf75b83",
  "created_at": "2026-10-08T21:40:15+09:00",
  "redactions_applied": false,
  "run_id": "phase2-db-tests",
  "sandbox": "unavailable"
}
