{
  "schema_version": 1,
  "run_id": "phase6-wallet-expenses",
  "iteration": 1,
  "agent": "chronoledger-orchestrator",
  "role": "dynamic-test",
  "base_sha": "2e2306f4d0c603a3ce554f407bbbd96df9761d6a",
  "target_sha": "16d17676e9f9bbc7b515bb370ddd82263107002b",
  "status": "passed",
  "created_at": "2026-10-08T14:09:00Z",
  "finished_at": "2026-10-08T14:10:13Z",
  "sandbox": "unavailable",
  "redactions_applied": false,
  "tests": [
    {
      "name": "TypeScript Type Check",
      "command": "npx tsc --noEmit",
      "status": "passed",
      "exit_code": 0
    },
    {
      "name": "ESLint Check",
      "command": "npm run lint",
      "status": "passed",
      "exit_code": 0
    },
    {
      "name": "Vitest Unit Tests",
      "command": "npx vitest run",
      "status": "passed",
      "exit_code": 0
    },
    {
      "name": "Next.js Production Build",
      "command": "npm run build",
      "status": "passed",
      "exit_code": 0
    }
  ]
}
