{
  "run_id": "phase1-completion",
  "sandbox": "unavailable",
  "base_sha": "ea981a96e0044e0e8e0e770dcb79151df9d42d39",
  "agent": "ChronoLedger Orchestrator",
  "iteration": 1,
  "target_sha": "0ea0a9914b7947f9e1fb7d5302fcaccfff86b5ba",
  "redactions_applied": false,
  "created_at": "2026-10-08T21:17:33.2024640+09:00",
  "finished_at": "2026-10-08T21:17:33.2078919+09:00",
  "tests": [
    {
      "status": "passed",
      "command": "npm run test",
      "name": "Unit Tests (Vitest)",
      "exit_code": 0
    },
    {
      "status": "passed",
      "command": "npm run build",
      "name": "Static Export Build (Next.js)",
      "exit_code": 0
    }
  ],
  "status": "passed",
  "schema_version": 1,
  "role": "dynamic-test"
}
