{
  "tests": [
    {
      "command": "npm run test && npm run build",
      "exit_code": 0,
      "name": "Vitest 40 tests, build, lint",
      "status": "passed"
    }
  ],
  "target_sha": "39a116eac8dfd43cc8540b219c7b4148eb2cf9a9",
  "base_sha": "abb92040b0f7457cd33d98fb87f1ce8be02951e7",
  "schema_version": 1,
  "redactions_applied": false,
  "run_id": "phase3-auth-completion",
  "status": "passed",
  "role": "dynamic-test",
  "sandbox": "unavailable",
  "created_at": "2026-10-08T22:13:56+09:00",
  "iteration": 1,
  "agent": "ChronoLedger Orchestrator",
  "finished_at": "2026-10-08T22:13:56+09:00"
}
